{
  "eventId": "01M0KK5QA0V795JD27384BQ76P",
  "eventType": "ArrangementBroken",
  "eventVersion": 1,
  "occurredAt": "2026-11-05T02:00:00Z",
  "producer": "arrangement-service",
  "aggregateType": "Arrangement",
  "aggregateId": "01M0KK4T0G81VHMMR2AHBZ0AMD",
  "correlationId": "01M0KK4J6G01Y28P7580JE8SQ5",
  "payload": {
    "arrangementId": "01M0KK4T0G81VHMMR2AHBZ0AMD",
    "accountId": "01M0KK4M5029NKNFZXF7805T91",
    "reason": "INSTALLMENT_MISSED"
  }
}
