{
  "eventId": "01M0KK5NBGCMXVYPSG32VEPHJ6",
  "eventType": "PromiseBroken",
  "eventVersion": 1,
  "occurredAt": "2026-09-06T02:00:00Z",
  "producer": "arrangement-service",
  "aggregateType": "Promise",
  "aggregateId": "01M0KK4S18NPWJ059ZA293REG6",
  "correlationId": "01M0KK4J6G01Y28P7580JE8SQ5",
  "payload": {
    "promiseId": "01M0KK4S18NPWJ059ZA293REG6",
    "caseId": "01M0KK4P3G0MQSQ3A1X2PMA6VX",
    "accountId": "01M0KK4M5029NKNFZXF7805T91",
    "amountMinor": 50000,
    "currency": "EUR",
    "dueDate": "2026-09-05"
  }
}
